{
  "$schema": "https://json-schema.org/draft/2020-12/schema",
  "$id": "xdebug.axi.statistics.request.v1",
  "title": "axi.statistics request",
  "description": "Count completed AXI transactions with optional direction, ID, and address filters.",
  "x-description-zh": "按方向、ID 和地址过滤统计已完成 AXI 事务。",
  "type": "object",
  "properties": {
    "api_version": {
      "type": "string",
      "enum": [
        "xdebug.v1"
      ]
    },
    "action": {
      "type": "string",
      "enum": [
        "axi.statistics"
      ]
    },
    "target": {
      "type": "object",
      "properties": {
        "session_id": {
          "type": "string",
          "minLength": 1
        }
      },
      "required": [
        "session_id"
      ],
      "additionalProperties": false
    },
    "args": {
      "type": "object",
      "required": [
        "name"
      ],
      "properties": {
        "filter": {
          "type": "object",
          "properties": {
            "direction": {
              "type": "string",
              "enum": [
                "all",
                "read",
                "write"
              ],
              "default": "all",
              "description": "Transaction direction filter."
            },
            "address": {
              "oneOf": [
                {
                  "type": "object",
                  "description": "Exact-match branch: at least one listed value must equal the sampled field value.",
                  "required": [
                    "mode",
                    "values"
                  ],
                  "properties": {
                    "mode": {
                      "const": "exact",
                      "description": "Action processing or return mode. Its legal values, default, and interactions are action-specific."
                    },
                    "values": {
                      "type": "array",
                      "minItems": 1,
                      "uniqueItems": true,
                      "items": {
                        "type": "string",
                        "minLength": 1,
                        "oneOf": [
                          {
                            "pattern": "^[0-9]+$",
                            "description": "地址或字段过滤的候选值列表；候选之间按 OR 匹配，空列表不合法。"
                          },
                          {
                            "pattern": "^(?:[1-9][0-9]*)?'[bB][01](?:_?[01])*$",
                            "description": "地址或字段过滤的候选值列表；候选之间按 OR 匹配，空列表不合法。"
                          },
                          {
                            "pattern": "^(?:[1-9][0-9]*)?'[dD][0-9](?:_?[0-9])*$",
                            "description": "地址或字段过滤的候选值列表；候选之间按 OR 匹配，空列表不合法。"
                          },
                          {
                            "pattern": "^(?:[1-9][0-9]*)?'[hH][0-9a-fA-F](?:_?[0-9a-fA-F])*$",
                            "description": "地址或字段过滤的候选值列表；候选之间按 OR 匹配，空列表不合法。"
                          }
                        ],
                        "description": "Known unsigned decimal or b/d/h SystemVerilog literal up to 64 bits; X/Z and C-style 0x are rejected."
                      },
                      "description": "地址或字段过滤的候选值列表；候选之间按 OR 匹配，空列表不合法。"
                    }
                  },
                  "additionalProperties": false
                },
                {
                  "type": "object",
                  "description": "Inclusive-range branch: the sampled field value must lie between begin and end.",
                  "required": [
                    "mode",
                    "begin",
                    "end"
                  ],
                  "properties": {
                    "mode": {
                      "const": "range",
                      "description": "Action processing or return mode. Its legal values, default, and interactions are action-specific."
                    },
                    "begin": {
                      "type": "string",
                      "minLength": 1,
                      "oneOf": [
                        {
                          "pattern": "^[0-9]+$",
                          "description": "闭区间起点；省略时使用可用波形窗口起点。"
                        },
                        {
                          "pattern": "^(?:[1-9][0-9]*)?'[bB][01](?:_?[01])*$",
                          "description": "闭区间起点；省略时使用可用波形窗口起点。"
                        },
                        {
                          "pattern": "^(?:[1-9][0-9]*)?'[dD][0-9](?:_?[0-9])*$",
                          "description": "闭区间起点；省略时使用可用波形窗口起点。"
                        },
                        {
                          "pattern": "^(?:[1-9][0-9]*)?'[hH][0-9a-fA-F](?:_?[0-9a-fA-F])*$",
                          "description": "闭区间起点；省略时使用可用波形窗口起点。"
                        }
                      ],
                      "description": "Known unsigned decimal or b/d/h SystemVerilog literal up to 64 bits; X/Z and C-style 0x are rejected."
                    },
                    "end": {
                      "type": "string",
                      "minLength": 1,
                      "oneOf": [
                        {
                          "pattern": "^[0-9]+$",
                          "description": "闭区间终点；省略时使用可用波形窗口终点。"
                        },
                        {
                          "pattern": "^(?:[1-9][0-9]*)?'[bB][01](?:_?[01])*$",
                          "description": "闭区间终点；省略时使用可用波形窗口终点。"
                        },
                        {
                          "pattern": "^(?:[1-9][0-9]*)?'[dD][0-9](?:_?[0-9])*$",
                          "description": "闭区间终点；省略时使用可用波形窗口终点。"
                        },
                        {
                          "pattern": "^(?:[1-9][0-9]*)?'[hH][0-9a-fA-F](?:_?[0-9a-fA-F])*$",
                          "description": "闭区间终点；省略时使用可用波形窗口终点。"
                        }
                      ],
                      "description": "Known unsigned decimal or b/d/h SystemVerilog literal up to 64 bits; X/Z and C-style 0x are rejected."
                    }
                  },
                  "additionalProperties": false
                },
                {
                  "type": "object",
                  "description": "Masked-match branch: compare only the bits selected by mask against value.",
                  "required": [
                    "mode",
                    "value",
                    "mask"
                  ],
                  "properties": {
                    "mode": {
                      "const": "mask",
                      "description": "Action processing or return mode. Its legal values, default, and interactions are action-specific."
                    },
                    "value": {
                      "type": "string",
                      "minLength": 1,
                      "oneOf": [
                        {
                          "pattern": "^[0-9]+$"
                        },
                        {
                          "pattern": "^(?:[1-9][0-9]*)?'[bB][01](?:_?[01])*$"
                        },
                        {
                          "pattern": "^(?:[1-9][0-9]*)?'[dD][0-9](?:_?[0-9])*$"
                        },
                        {
                          "pattern": "^(?:[1-9][0-9]*)?'[hH][0-9a-fA-F](?:_?[0-9a-fA-F])*$"
                        }
                      ],
                      "description": "Known unsigned decimal or b/d/h SystemVerilog literal up to 64 bits; X/Z and C-style 0x are rejected."
                    },
                    "mask": {
                      "type": "string",
                      "minLength": 1,
                      "oneOf": [
                        {
                          "pattern": "^[0-9]+$"
                        },
                        {
                          "pattern": "^(?:[1-9][0-9]*)?'[bB][01](?:_?[01])*$"
                        },
                        {
                          "pattern": "^(?:[1-9][0-9]*)?'[dD][0-9](?:_?[0-9])*$"
                        },
                        {
                          "pattern": "^(?:[1-9][0-9]*)?'[hH][0-9a-fA-F](?:_?[0-9a-fA-F])*$"
                        }
                      ],
                      "description": "Known unsigned decimal or b/d/h SystemVerilog literal up to 64 bits; X/Z and C-style 0x are rejected."
                    }
                  },
                  "additionalProperties": false
                }
              ],
              "description": "Exactly one address filtering mode: exact queue, inclusive range, or value/mask."
            },
            "ids": {
              "type": "array",
              "minItems": 1,
              "uniqueItems": true,
              "items": {
                "type": "string",
                "minLength": 1,
                "oneOf": [
                  {
                    "pattern": "^[0-9]+$"
                  },
                  {
                    "pattern": "^(?:[1-9][0-9]*)?'[bB][01](?:_?[01])*$"
                  },
                  {
                    "pattern": "^(?:[1-9][0-9]*)?'[dD][0-9](?:_?[0-9])*$"
                  },
                  {
                    "pattern": "^(?:[1-9][0-9]*)?'[hH][0-9a-fA-F](?:_?[0-9a-fA-F])*$"
                  }
                ],
                "description": "Known unsigned decimal or b/d/h SystemVerilog literal up to 64 bits; X/Z and C-style 0x are rejected."
              },
              "description": "AXI transaction ID queue; values are ORed within the queue."
            }
          },
          "additionalProperties": false,
          "description": "Completed-transaction filters; direction, IDs, and address are combined with AND."
        },
        "name": {
          "type": "string",
          "description": "Saved-object name in this action namespace; do not assume names are shared by cursors, lists, and protocol configs."
        },
        "value_format": {
          "type": "string",
          "enum": [
            "hex",
            "bin",
            "dec"
          ],
          "default": "hex",
          "description": "返回 LogicValue 的显示格式；不改变比较、采样或底层四态值。"
        }
      },
      "additionalProperties": false
    },
    "request_id": {
      "type": "string",
      "minLength": 1
    },
    "limits": {
      "type": "object",
      "properties": {
        "timeout_ms": {
          "type": "integer",
          "minimum": 1,
          "maximum": 2147483647,
          "description": "Positive public frontend-to-engine request timeout in milliseconds. Omit limits.timeout_ms to disable the public watchdog."
        }
      },
      "additionalProperties": false
    }
  },
  "additionalProperties": false,
  "required": [
    "api_version",
    "action",
    "args",
    "target"
  ],
  "x-purpose": "统计已完成 AXI 事务。",
  "x-how_it_works": "复用 canonical AXI 缓存；ID 队列内部取 OR，direction、ID、address 三类条件取 AND。",
  "x-when_to_use": "按方向、ID 和地址核对 AXI 事务次数。",
  "x-arg_contract_notes": "required: name; filter direction/ids/address with AND; address mode is exact/range/mask",
  "x-agent": {
    "use_when": [
      "Count completed AXI read and write transactions after applying protocol filters."
    ],
    "do_not_use_when": [
      "Inspecting individual AXI payload beats or pending transactions."
    ],
    "alternatives": [],
    "constraints": [
      "required: name; filter direction/ids/address with AND; address mode is exact/range/mask"
    ]
  }
}
